{"$schema":"https://cdn.jsdelivr.net/gh/forge-arcana/kod-data@main/schema/rates.schema.json","dataset":"rates","date":"2026-09-02","updated":"2026-09-04T02:58:44.861Z","sources":["nyfed","ecb","bis"],"sourcesMeta":{"nyfed":{"date":"2026-09-02"},"ecb":{"date":"2026-09-02"},"bis":{"date":"2026-09-01"}},"reference":{"SOFR":{"percent":3.65,"date":"2026-09-02","source":"nyfed"},"ESTR":{"percent":2.188,"date":"2026-09-02","source":"ecb"}},"policy":{"AR":{"percent":29,"date":"2025-07-10"},"AU":{"percent":4.35,"date":"2026-08-27"},"BR":{"percent":14,"date":"2026-09-01"},"CA":{"percent":2.25,"date":"2026-08-31"},"CH":{"percent":0,"date":"2026-09-01"},"CL":{"percent":4.5,"date":"2026-09-01"},"CN":{"percent":3,"date":"2026-09-01"},"CO":{"percent":12,"date":"2026-08-26"},"CZ":{"percent":3.75,"date":"2026-08-31"},"DK":{"percent":1.85,"date":"2026-08-31"},"GB":{"percent":3.75,"date":"2026-08-28"},"HK":{"percent":4,"date":"2026-08-31"},"HU":{"percent":5.5,"date":"2026-08-26"},"ID":{"percent":5.75,"date":"2026-07-22"},"IL":{"percent":3.5,"date":"2026-07-31"},"IN":{"percent":5.25,"date":"2026-07-23"},"IS":{"percent":8,"date":"2026-09-01"},"JP":{"percent":1,"date":"2026-09-01"},"KR":{"percent":2.75,"date":"2026-08-03"},"KW":{"percent":3.5,"date":"2026-08-26"},"MA":{"percent":2.25,"date":"2026-06-25"},"MK":{"percent":4.25,"date":"2026-09-01"},"MX":{"percent":6.5,"date":"2026-09-01"},"MY":{"percent":2.75,"date":"2026-08-28"},"NO":{"percent":4.25,"date":"2026-08-31"},"NZ":{"percent":2.5,"date":"2026-08-28"},"PE":{"percent":4.25,"date":"2026-08-31"},"PL":{"percent":3.75,"date":"2026-09-01"},"RO":{"percent":6.5,"date":"2026-09-01"},"RS":{"percent":5.75,"date":"2026-08-31"},"RU":{"percent":14,"date":"2026-09-01"},"SA":{"percent":4.25,"date":"2026-08-30"},"SE":{"percent":1.75,"date":"2026-09-01"},"TH":{"percent":1,"date":"2026-08-27"},"TR":{"percent":37,"date":"2026-08-28"},"US":{"percent":3.625,"date":"2026-09-01"},"XM":{"percent":2.25,"date":"2026-09-01"},"ZA":{"percent":7,"date":"2026-08-25"}}}